{
  "$schema": "https://json-schema.org/draft/2020-12/schema",
  "type": "object",
  "additionalProperties": false,
  "required": [
    "article_id",
    "title",
    "source",
    "published_at",
    "duration_seconds",
    "score",
    "is_priority",
    "tags",
    "entities",
    "metrics"
  ],
  "properties": {
    "article_id": {
      "type": "string",
      "minLength": 1
    },
    "title": {
      "type": "string",
      "minLength": 1
    },
    "source": {
      "type": "object",
      "required": [
        "name",
        "country",
        "type"
      ],
      "additionalProperties": false,
      "properties": {
        "name": {
          "type": "string"
        },
        "country": {
          "type": "string",
          "minLength": 2,
          "maxLength": 2
        },
        "type": {
          "type": "string"
        }
      }
    },
    "published_at": {
      "type": "string",
      "format": "date-time"
    },
    "duration_seconds": {
      "type": "number",
      "minimum": 0
    },
    "score": {
      "type": "number",
      "minimum": 0,
      "maximum": 1
    },
    "is_priority": {
      "type": "boolean"
    },
    "tags": {
      "type": "array",
      "items": {
        "type": "string"
      },
      "minItems": 1
    },
    "entities": {
      "type": "array",
      "items": {
        "type": "object",
        "required": [
          "type",
          "name",
          "confidence"
        ],
        "additionalProperties": false,
        "properties": {
          "type": {
            "type": "string"
          },
          "name": {
            "type": "string"
          },
          "confidence": {
            "type": "number",
            "minimum": 0,
            "maximum": 1
          }
        }
      }
    },
    "metrics": {
      "type": "object",
      "required": [
        "word_count",
        "sentiment"
      ],
      "additionalProperties": false,
      "properties": {
        "word_count": {
          "type": "integer",
          "minimum": 0
        },
        "sentiment": {
          "type": "string",
          "enum": [
            "positive",
            "neutral",
            "negative"
          ]
        }
      }
    }
  }
}
