{
  "article_id": "art-2026-0001",
  "title": "Analyse économique 2026",
  "source": {
    "name": "Le Monde",
    "country": "FR",
    "type": "media"
  },
  "published_at": "2026-07-03T10:15:00Z",
  "duration_seconds": 12.4,
  "score": 0.87,
  "is_priority": true,
  "tags": [
    "economy",
    "policy",
    "europe"
  ],
  "entities": [
    {
      "type": "person",
      "name": "Jane Doe",
      "confidence": 0.94
    },
    {
      "type": "organization",
      "name": "European Commission",
      "confidence": 0.91
    }
  ],
  "metrics": {
    "word_count": 1240,
    "sentiment": "neutral"
  }
}
